<?xml version="1.0" encoding="UTF-8"?>
<Medicins xmlns:xsi="http://www.w3.org/2001/XMLSchema-instance"
              xmlns="http://www.example.com/Medicins"
              xsi:schemaLocation="http://www.example.com/Medicins Medicins.xsd">

    <Antibiotic name="Test antibiotic" CAS="12345-67-8" drug_bank="AB00000" recipe="true">
        <Pharm>Test Pharmacy</Pharm>
        <Version analog="Test trade name">
            <Producer>Test producer</Producer>
            <Form>pills</Form>
            <Certificate>
                <Registration_date>2010-01-01</Registration_date>
                <Amount>Is not supposed to be here</Amount>
                <Registered_by>Test registration</Registered_by>
                <Expiration_date>2020-01-01</Expiration_date>
            </Certificate>
            <Package>
                <Quantity>0</Quantity>
                <Price>200.00</Price>
            </Package>
            <Dosage>
                <Amount>Test amount</Amount>
                <Frequency>Test frequency</Frequency>
            </Dosage>
        </Version>
    </Antibiotic>

</Medicins>